Code/.Rproj.user/shared/notebooks/F30BF724-Lab_7/1/s/c1cpar6n7k72k/00000f.csv

"0","# Build model 1"
"0","m1 <- listings %>%"
"0","  lm(price ~ room_type, "
"0","     data = .) "
"0",""
"0","# And pass to summary function to see regression output"
"0","m1 %>% summary()"
"1","
Call:
"
"1",""
"1","lm(formula = price ~ room_type, data = .)"
"1",""
"1","

"
"1",""
"1","Residuals:
"
"1","    Min "
"1","     1Q "
"1"," Median "
"1","     3Q "
"1","    Max "
"1","
"
"1","-218.35 "
"1"," -57.58 "
"1"," -24.23 "
"1","   4.42 "
"1"," 938.77 "
"1","
"
"1","
Coefficients:
"
"1","                     "
"1"," Estimate"
"1"," Std. Error"
"1"," t value"
"1"," Pr(>|t|)"
"1","    "
"1","
(Intercept)          "
"1","  142.582"
"1","      1.441"
"1","  98.919"
"1","  < 2e-16"
"1"," ***"
"1","
room_typePrivate room"
"1","  -81.348"
"1","      2.399"
"1"," -33.907"
"1","  < 2e-16"
"1"," ***"
"1","
room_typeShared room "
"1","  100.766"
"1","     16.228"
"1","   6.209"
"1"," 5.47e-10"
"1"," ***"
"1","
"
"1","---
Signif. codes:  "
"1",""
"1","0 ‘***’ 0.001 ‘**’ 0.01 ‘*’ 0.05 ‘.’ 0.1 ‘ ’ 1"
"1","
"
"1","
Residual standard error:"
"1"," "
"1","134.3"
"1"," "
"1","on"
"1"," "
"1","13644"
"1"," "
"1","degrees of freedom"
"1","
"
"1","Multiple R-squared: "
"1"," "
"1","0.08172"
"1",",	Adjusted R-squared: "
"1"," "
"1","0.08158"
"1"," "
"1","
F-statistic:"
"1"," "
"1","607.1"
"1"," "
"1","on"
"1"," "
"1","2"
"1"," "
"1","and"
"1"," "
"1","13644"
"1"," "
"1","DF,  p-value:"
"1"," "
"1","< 2.2e-16"
"1","
"
"1","
"

Tutorial/Markdown/Tutorial_7.md

## 8.2 Model 1: Basic bivariate model

- A private room listing is going to be \$81.35 less (-81.348) on average than a listing which is an entire home or apartment (the reference category).

- A shared room listing is going to be \$100.76 more (100.766) on average than an entire home or apartment listing.

Here x (or our independent variable ) = 0 is our *reference category*: `Entire home/apt` . So the coefficient here (142.582) means that, on average (i.e. not for *every* entire home or apartment in the dataset), an entire home or apartment listing will cost \$142.58.

### 8.2.1 Model 1: Baseline is our inferential test

- **the mean for Private Room is 61.23363:** our coefficient is -81.348, the difference between Entire home/appt and Private Room. So how much does a Private Room actually cost on average\> Let’s work it out:

1.  the mean cost for Entire home/appt (\$142.58)